{
  "locale": "zh-CN",
  "source_sha": "3b883c82ce83b1dbccb83c5def2fd6a69a6b590b",
  "generated_at": "2026-06-12T04:35:47Z",
  "glossary": {},
  "skills": {
    "motion-word-forward": {
      "title": "按单词向前跳转",
      "teach": "w 将光标移动到下一个单词的开头；计数会使其重复，因此 2w 向前跳转两个单词。这是最常用的水平移动方式，远比连续按 l 快得多。",
      "key_commands": [
        "w",
        "3w",
        "b",
        "e"
      ],
      "challenges": [
        {
          "hint": "w 前面的计数会使其重复",
          "why": "两次单词跳转只需两次按键就能到达 'staging'。"
        },
        {
          "hint": "先计数，然后 w",
          "why": "w 以单词为单位计数，而非字符——距离无关紧要。"
        },
        {
          "hint": "w 移动到下一个单词；计数可以跳过多个",
          "why": "w 移动到下一个单词的开头。"
        },
        {
          "hint": "w 移动到下一个单词；计数可以跳过多个",
          "why": "3w 向前移动 3 个单词。"
        }
      ]
    },
    "operator-delete-line": {
      "title": "删除整行 (dd)",
      "teach": "dd 删除当前行，按行删除。先用动作 (j/k 或计数) 到达目标行，然后执行 dd。被删除的行会存入无名寄存器，之后可用 p 粘贴回来。",
      "key_commands": [
        "dd",
        "jdd",
        "2dd",
        "p"
      ],
      "challenges": [
        {
          "hint": "向下移动到有问题的行，然后删除它",
          "why": "j 到达该行，dd 按行删除它。"
        },
        {
          "hint": "向下两行，然后 dd",
          "why": "在操作符前组合动作来定位目标行。"
        },
        {
          "hint": "移动到狗狗的不幸任务并删除。",
          "why": "j 向下到该行，dd 删除它。"
        },
        {
          "hint": "深入混乱，消除恐惧。",
          "why": "2j 向下两行，dd 删除它。"
        }
      ]
    },
    "textobj-change-in-quotes": {
      "title": "修改引号内部 (ci\")",
      "teach": "ci\" 修改光标所在行最近的一对双引号之间的文本——无论光标在行内的哪个位置，Vim 都会向前搜索找到它们。引号本身保持不变；只有其内容被替换，并且你会进入插入模式。",
      "key_commands": [
        "ci\"",
        "ci'",
        "ci(",
        "cit"
      ],
      "challenges": [
        {
          "hint": "修改引号内的内容",
          "why": "ci\" 为你找到引号内的文本，然后让你进入插入模式。"
        },
        {
          "hint": "ci\" 清除整个引号内的字符串",
          "why": "一个文本对象交换操作在一次动作中替换了整个路径。"
        },
        {
          "hint": "将混乱转变为建设",
          "why": "ci' 修改单引号内的文本。"
        },
        {
          "hint": "将开关从暗切换到亮",
          "why": "ci\" 修改双引号内的文本。"
        },
        {
          "hint": "一击将失败变为成功",
          "why": "ci\" 修改双引号内的文本。"
        },
        {
          "hint": "通过快速修改保持系统运行",
          "why": "ci\" 修改双引号内的文本。"
        }
      ]
    },
    "dot-command-repeat": {
      "title": "使用点命令重复修改",
      "teach": "点命令 (.) 重放你的上一次修改 — 从进入插入模式并输入，到删除操作。点公式是理想方式：让第一次修改可重复，然后只需一次按键移动 (j) 和一次执行 (.)。使用 A 追加，这样光标列位置就无关紧要了。",
      "key_commands": [
        "A",
        ".",
        "j.",
        "u"
      ],
      "challenges": [
        {
          "hint": "在第一行使用 A;，然后 j. 一路向下",
          "why": "A 从任意位置追加到行尾，因此 . 可以干净地向下重复整个块。"
        },
        {
          "hint": "注释第一个调用，然后 j. 将其传播到其余部分",
          "why": "I// 是可重复的修改；一次移动加一次执行即可注释每一行。"
        },
        {
          "hint": "使用 I-- 注释掉第一行可怕的代码，然后 j. 处理其余行",
          "why": "让第一次修改可重复，点命令就会免费完成剩下的工作。"
        }
      ]
    },
    "insert-entry-points": {
      "title": "在正确的位置进入插入模式",
      "teach": "不要浪费动作来移动到你想输入的位置。A 在行尾追加，I 在第一个非空字符前插入，o 在下方打开一行，O 在上方打开一行。每个都将一个动作和模式切换合并为一个按键，并且每个都可以用点命令重复。",
      "key_commands": [
        "A",
        "I",
        "o",
        "O"
      ],
      "challenges": [
        {
          "hint": "在行尾追加，无论光标在哪里",
          "why": "A = $a： 一键跳转到行尾并追加。"
        },
        {
          "hint": "在第一个字符前插入",
          "why": "I = ^i： 无需先按 0 即可在行首插入。"
        },
        {
          "hint": "在下方打开新行并输入",
          "why": "o 在下方打开一行并一键进入插入模式。"
        },
        {
          "hint": "在上方打开新行",
          "why": "O 在上方打开一行 -- 无需先上移再按 o。"
        },
        {
          "hint": "直接跳转到行尾",
          "why": ""
        }
      ]
    },
    "change-to-eol-C": {
      "title": "修改到行尾 (C)",
      "teach": "C 删除从光标到行尾的内容并进入插入模式 - 它是 c$ 的简写。 定位到你想替换的第一个字符 , 按下 C , 然后重新输入尾部内容。",
      "key_commands": [
        "C",
        "c$",
        "D",
        "d$"
      ],
      "challenges": [
        {
          "hint": "从光标处 , 清除该行剩余部分",
          "why": "C 清除到行尾并一步进入插入模式。"
        },
        {
          "hint": "C 吃掉到行尾的内容 ; 输入替换文本",
          "why": "一键替换从光标往后的所有内容。"
        },
        {
          "hint": "修复从斜杠往后的所有内容",
          "why": ""
        },
        {
          "hint": "替换该行的剩余部分",
          "why": ""
        }
      ]
    },
    "substitute-char-dot": {
      "title": "一退三进 (s + 点命令)",
      "teach": "s 删除光标下的字符并进入插入模式（相当于 cl）。结合 f{char} 查找目标，再用 ; 重复查找，你就得到了完全可重复的编辑：f 定位，s 替换，然后 ;. 横扫其余。",
      "key_commands": [
        "s",
        "f",
        ";",
        "."
      ],
      "challenges": [
        {
          "hint": "查找 +，将其替换为 ' + '，然后 ;. 重复",
          "why": "让查找 (;) 和修改 (.) 都可重复才是赢家。"
        },
        {
          "hint": "f| 定位到竖线，s 替换为 ' / '，其余用 ;.",
          "why": "又是点命令公式：一个查找重复，一个修改重复。"
        },
        {
          "hint": "查找 '@'，将其改为 '#'，然后像水果忍者一样重复。",
          "why": "s 交换字符；; 查找下一个，. 重复它。"
        },
        {
          "hint": "定位 '~'，将其改为 '*'，让配方变形。",
          "why": "s 交换字符；; 查找下一个，. 重复它。"
        }
      ]
    },
    "compose-delete-word": {
      "title": "构造可重复的单词删除 (daw)",
      "teach": "删除一个单词的方法不止一种；选择可重复的那种。db 然后 x 让你无法重复。daw（'删除一个单词'）会删除单词以及相邻的一个空格，作为一个单独的、点命令可重复的修改。",
      "key_commands": [
        "daw",
        "diw",
        "db",
        "."
      ],
      "challenges": [
        {
          "hint": "删除一个单词 — 它也会带走尾随/前导空格",
          "why": "daw 是一个你可以重复的整洁修改；db 然后 x 则不是。"
        },
        {
          "hint": "跳到单词上，然后 daw",
          "why": "aw 抓取单词加上一个空格，这样就不会留下双空格。"
        }
      ]
    },
    "search-word-under-cursor": {
      "title": "搜索光标下的单词 (*)",
      "teach": "* 搜索光标下的整个单词并跳转到它的下一个出现 — 无需手动输入该单词。然后 n 向前重复搜索，N 向后。它与可重复的修改配合得非常好。",
      "key_commands": [
        "*",
        "#",
        "n",
        "N"
      ],
      "challenges": [
        {
          "hint": "一个按键即可搜索光标所在的单词",
          "why": "* 省去了你输入 /budget 的麻烦 — 只需指向并跳转。"
        },
        {
          "hint": "* 为你找到下一个 'total'",
          "why": "指向搜索比在 / 后拼写单词更高效。"
        }
      ]
    },
    "count-vs-repeat": {
      "title": "计数, 还是重复?",
      "teach": "d2w 和 2dw 都删除两个单词; dw. 先删除一个然后重复. 当你需要细粒度的撤销和随时停止的自由时, 优先使用 dw.; 当你随后会进入插入模式 (c3w) 时, 使用计数, 这样撤销会保持为一个干净的块.",
      "key_commands": [
        "d2w",
        "2dw",
        "dw.",
        "d3w"
      ],
      "challenges": [
        {
          "hint": "将四个过时的单词作为一个撤销块删除",
          "why": "计数使撤销保持为单个块——在进行更多编辑之前很方便."
        },
        {
          "hint": "删除一个单词, 然后用点命令重复",
          "why": "dw. 提供逐词撤销; 如果删多了, 按一次 u 即可回退."
        },
        {
          "hint": "通过删除引言单词来清爽开局.",
          "why": "d2w 将两个单词作为一次修改删除——一次 u 即可撤销."
        },
        {
          "hint": "是时候将两个扫入历史了.",
          "why": "dw, 然后 . 重复——每次删除都有各自的撤销."
        },
        {
          "hint": "两次揉捏, 面团即成.",
          "why": "2dw 将两个单词作为一次修改删除——一次 u 即可撤销."
        }
      ]
    },
    "case-operators": {
      "title": "大小写操作 (gU, gu, g~)",
      "teach": "大小写修改是一个操作符，因此遵循操作符+动作的语法。gU 转为大写，gu 转为小写，g~ 翻转大小写。可以与任何动作或文本对象组合 (gUaw, guap)，或双击作用于整行 (gUU, guu, g~~)。",
      "key_commands": [
        "gU",
        "gu",
        "g~",
        "g~~"
      ],
      "challenges": [
        {
          "hint": "HTTP 动词是常量 — 将值转为大写",
          "why": "gU 是操作符，iw 是其动作：将一个单词转为常量。"
        },
        {
          "hint": "双击操作符，让整行横幅文字都变成大写",
          "why": "双击操作符 (gUU) 会按行操作，就像 dd 或 >>。"
        },
        {
          "hint": "驯服那个还保持大写锁定状态的单词",
          "why": "guiw 只将那个孤立的全大写单词转为小写，而不是整行。"
        },
        {
          "hint": "整行的大小写被翻转了",
          "why": "g~~ 翻转每个字符的大小写 — 一次性撤销卡住的大写锁定。"
        }
      ]
    },
    "increment-number": {
      "title": "数字增减 (<C-a>, <C-x>)",
      "teach": "<C-a> 增加光标处或之后的数字；<C-x> 减少。没有计数时，它们每次增减 1，但加上计数就会增减相应数量：180<C-x> 减去 180。如果光标不在数字上，Vim 会向前跳到行内的下一个数字 -- 所以你很少需要先瞄准。",
      "key_commands": [
        "<C-a>",
        "<C-x>",
        "10<C-a>",
        "180<C-x>"
      ],
      "challenges": [
        {
          "hint": "增加数字 -- Vim 会帮你找到它",
          "why": "<C-a> 将下一个数字加 1，无需瞄准光标。"
        },
        {
          "hint": "计数可以增加那么多",
          "why": "3<C-a> 一次增加三 -- 可在宏中重复。"
        },
        {
          "hint": "使用计数进行减法；光标会跳到数字上",
          "why": "180<C-x> 找到 0 并减去 180 -- 每行都使用相同的按键。"
        },
        {
          "hint": "饼干怪兽又来了；策略性地减法！",
          "why": "10<C-x> 从光标下的数字减去 10。"
        },
        {
          "hint": "像专业开发者一样减少那些评论。",
          "why": "2<C-x> 从光标下的数字减去 2。"
        }
      ]
    },
    "insert-paste-register": {
      "title": "在插入模式下粘贴寄存器内容",
      "teach": "在插入模式中，你可以使用 <C-r>{reg} 粘贴寄存器内容，无需返回普通模式。<C-r>0 粘贴的是复制寄存器（你上次复制的内容，不会被删除操作影响），非常适合回显你已经抓取的文本。",
      "key_commands": [
        "<C-r>0",
        "<C-r>\"",
        "y$",
        "yiw"
      ],
      "challenges": [
        {
          "hint": "复制标题，跳到第 2 行，追加，然后 <C-r>0",
          "why": "<C-r>0 将复制寄存器的内容直接重放到插入模式中。"
        },
        {
          "hint": "复制单词，然后在插入模式下将其粘贴到下一行",
          "why": "用 yiw 抓取一次，然后用 <C-r>0 在任何地方回显它。"
        },
        {
          "hint": "将复制的单词回显到下一行",
          "why": ""
        },
        {
          "hint": "在输入时粘贴版本字符串",
          "why": ""
        }
      ]
    },
    "insert-expression-calc": {
      "title": "原地计算 (<C-r>=)",
      "teach": "表达式寄存器，在插入模式下通过 <C-r>= 访问，可计算任意 Vim 表达式并插入结果。它将编辑器变成一个随手可用的计算器，不会打断你的工作流。",
      "key_commands": [
        "<C-r>=",
        "A",
        "<CR>"
      ],
      "challenges": [
        {
          "hint": "追加，打开表达式寄存器，输入求和表达式",
          "why": "<C-r>= 计算 6*7 并将 42 直接放到你正在输入的位置。"
        },
        {
          "hint": "让 Vim 为你做算术",
          "why": "无需心算：<C-r>= 计算并插入总和。"
        },
        {
          "hint": "下蛋可是严肃的数学！",
          "why": "<C-r>= 在插入过程中插入求和结果。"
        },
        {
          "hint": "有了数学，新年来得更快。",
          "why": "<C-r>= 在插入过程中插入求和结果。"
        },
        {
          "hint": "用数学的清晰度理解图像。",
          "why": "<C-r>= 在插入过程中插入求和结果。"
        }
      ]
    },
    "visual-prefer-operator": {
      "title": "偏好操作符而非可视命令",